{
  "key": "PM49_DECISION",
  "name": "Apply CompleteHold when medical review rejects specimen",
  "description": "Decision-returned trigger: when a medical review decision of Reject is returned, place a CompleteHold on the test.",
  "priority": 5,
  "phase": "Validate",
  "enabled": true,
  "version": 1,
  "effectiveDate": "0001-01-01T00:00:00+00:00",
  "appliesWhen": {
    "type": "leaf",
    "subject": "medicalReview.decision",
    "operator": "Equals",
    "value": "Reject"
  },
  "onSuccess": {
    "type": "Continue"
  },
  "onFailure": {
    "type": "CompleteHold",
    "scope": "test",
    "reason": "Medical review rejected specimen — order held"
  }
}
